{
  "decision_id": "DEC-G2-H2-0001",
  "project_id": "FHZ-ENTERPRISE-001",
  "schema_version": "1.0.0",
  "decision_type": "technical",
  "subject": "수소 공급 기준선 조건부 승인",
  "status": "conditional",
  "options": ["proceed", "proceed_with_conditions", "hold", "stop"],
  "recommendation": "proceed_with_conditions",
  "decision_owner_role": "Chief Engineer",
  "approvers": [{"role": "Chief Engineer", "user_id": null, "display_name": null, "organization": null}, {"role": "HSE/Regulatory Authority", "user_id": null, "display_name": null, "organization": null}],
  "evidence_ids": ["EVD-H2-SUPPLY-001"],
  "invocation_ids": ["CALL-M-041-AG-TEC-001-0001"],
  "conditions": ["공급계약서 또는 공급사 보증자료 등록", "저장 자립일수 재계산", "인간 검토 완료"],
  "human_signoff": true,
  "created_at": "2026-09-17T09:35:00Z",
  "decided_at": null,
  "supersedes_decision_id": null,
  "extensions": {}
}
